{"appCompatibility":{"maximum":null,"minimum":"phase8-rc-1","productionAppReadsArtifact":false},"chunked":{"eventCount":3,"indexJson":{"bytes":1810,"contentType":"application/json","digest":"sha256:da5c6c3ab227823acf93636ac32f9946cfaa3739593ff25502c669f9a54456ff","path":"releases/aa188b3e91d76774/chunked/event-index.json"},"indexScript":{"bytes":1853,"contentType":"text/javascript","digest":"sha256:a0fda1aa71fb5b71e1bcedb54b364e3e273189cdad22f03ab087aef3c3694637","path":"releases/aa188b3e91d76774/chunked/event-index.data.js"},"jsonFiles":4,"largestChunkBytes":1336,"scriptFiles":4,"totalJsonBytes":5308},"counts":{"encounters":3,"enemies":3,"events":3,"stages":3},"dataClassification":"synthetic-public-fixture","datasetVersion":"phase8-synthetic-preview-v1","full":{"json":{"bytes":3702,"contentType":"application/json","digest":"sha256:246a9f886493fc6b567b1a83ffdc7c53f1c34b037ed7d9b0e4d1b436b990c760","path":"releases/aa188b3e91d76774/full/runtime.min.json"},"script":{"bytes":3746,"contentType":"text/javascript","digest":"sha256:6d20e58a85190196a5f24960b58b935d76a886e712529231da3baaa29c86a136","path":"releases/aa188b3e91d76774/full/runtime.data.js"}},"generatedAt":"2026-08-24T00:00:00.000Z","knownGood":{"datasetVersion":"phase8-synthetic-preview-v1","retainedReleaseCount":2,"runtimeDigest":"sha256:246a9f886493fc6b567b1a83ffdc7c53f1c34b037ed7d9b0e4d1b436b990c760"},"permission":{"liveSourceAccessAllowed":false,"productionActivateAllowed":false,"publicArtifactAllowed":true,"releaseCandidatePreviewAllowed":true},"productionActivated":false,"releaseCandidate":true,"runtimeSchemaVersion":"1.0.0","schemaVersion":"1.0.0","updatePolicy":{"browserPatRequired":false,"userInitiated":true,"zeroOperationEnabled":false},"validation":{"hardFailCount":0,"note":"Fictional Phase 8 public preview fixture; production activation is prohibited.","reviewRequiredCount":0,"status":"passed"}}